{
  "id": "lybra-v2",
  "name": "Lybra V2",
  "type": "cdp",
  "website": "https://lybra.finance",
  "github": "",
  "docs": "",
  "tags": [
    "cdp",
    "ethereum"
  ],
  "contracts": {
    "main": {
      "name": "Lybra V2 Main Contract",
      "type": "core",
      "description": "Main contract for Lybra V2",
      "proxy": false,
      "keyEvents": [],
      "keyFunctions": [],
      "useCases": []
    }
  },
  "deployments": {
    "ethereum": {
      "chain": "ethereum",
      "addresses": {
        "main": ""
      },
      "deploymentBlocks": {
        "main": null
      },
      "verified": {
        "main": false
      },
      "source": [
        "defillama"
      ],
      "sourceUrl": "https://defillama.com/protocol/lybra-v2",
      "updated": "2025-01-31"
    }
  }
}