{
  "id": "apricot-finance",
  "name": "Apricot Finance",
  "type": "lending",
  "website": "https://apricot.one/#/",
  "github": "",
  "docs": "",
  "tags": [
    "lending",
    "solana"
  ],
  "contracts": {
    "main": {
      "name": "Apricot Finance Main Contract",
      "type": "core",
      "description": "Main contract for Apricot Finance",
      "proxy": false,
      "keyEvents": [],
      "keyFunctions": [],
      "useCases": []
    }
  },
  "deployments": {
    "solana": {
      "chain": "solana",
      "addresses": {
        "main": ""
      },
      "deploymentBlocks": {
        "main": null
      },
      "verified": {
        "main": false
      },
      "source": [
        "defillama"
      ],
      "sourceUrl": "https://defillama.com/protocol/apricot-finance",
      "updated": "2025-01-31",
      "platform": "svm"
    }
  }
}