{
  "id": "stabl.fi-v1",
  "name": "Stabl.fi V1",
  "type": "yield",
  "website": "",
  "github": "",
  "docs": "",
  "tags": [
    "yield",
    "polygon"
  ],
  "contracts": {
    "main": {
      "name": "Stabl.fi V1 Main Contract",
      "type": "core",
      "description": "Main contract for Stabl.fi V1",
      "proxy": false,
      "keyEvents": [],
      "keyFunctions": [],
      "useCases": []
    }
  },
  "deployments": {
    "polygon": {
      "chain": "polygon",
      "addresses": {
        "main": ""
      },
      "deploymentBlocks": {
        "main": null
      },
      "verified": {
        "main": false
      },
      "source": [
        "defillama"
      ],
      "sourceUrl": "https://defillama.com/protocol/stabl.fi-v1",
      "updated": "2025-01-31"
    }
  }
}