{
  "id": "vee-finance",
  "name": "Vee Finance",
  "type": "lending",
  "website": "https://vee.finance/home",
  "github": "",
  "docs": "",
  "tags": [
    "lending",
    "avalanche"
  ],
  "contracts": {
    "main": {
      "name": "Vee Finance Main Contract",
      "type": "core",
      "description": "Main contract for Vee Finance",
      "proxy": false,
      "keyEvents": [],
      "keyFunctions": [],
      "useCases": []
    }
  },
  "deployments": {
    "avalanche": {
      "chain": "avalanche",
      "addresses": {
        "main": ""
      },
      "deploymentBlocks": {
        "main": null
      },
      "verified": {
        "main": false
      },
      "source": [
        "defillama"
      ],
      "sourceUrl": "https://defillama.com/protocol/vee-finance",
      "updated": "2025-01-31"
    }
  }
}