{
  "id": "jigsaw",
  "name": "Jigsaw",
  "type": "cdp",
  "website": "https://app.jigsaw.finance/",
  "github": "",
  "docs": "",
  "tags": [
    "cdp",
    "ethereum"
  ],
  "contracts": {
    "main": {
      "name": "Jigsaw Main Contract",
      "type": "core",
      "description": "Main contract for Jigsaw",
      "proxy": false,
      "keyEvents": [],
      "keyFunctions": [],
      "useCases": []
    }
  },
  "deployments": {
    "ethereum": {
      "chain": "ethereum",
      "addresses": {
        "main": ""
      },
      "deploymentBlocks": {
        "main": null
      },
      "verified": {
        "main": false
      },
      "source": [
        "defillama"
      ],
      "sourceUrl": "https://defillama.com/protocol/jigsaw",
      "updated": "2025-01-31"
    }
  }
}