{
  "id": "compound-v3",
  "name": "Compound V3",
  "type": "lending",
  "website": "https://v3-app.compound.finance/",
  "github": "",
  "docs": "",
  "tags": [
    "lending",
    "ethereum",
    "arbitrum",
    "base",
    "polygon",
    "mantle",
    "unichain",
    "ronin",
    "scroll"
  ],
  "contracts": {
    "main": {
      "name": "Compound V3 Main Contract",
      "type": "core",
      "description": "Main contract for Compound V3",
      "proxy": false,
      "keyEvents": [],
      "keyFunctions": [],
      "useCases": []
    }
  },
  "deployments": {
    "ethereum": {
      "chain": "ethereum",
      "addresses": {
        "main": ""
      },
      "deploymentBlocks": {
        "main": null
      },
      "verified": {
        "main": false
      },
      "source": [
        "defillama"
      ],
      "sourceUrl": "https://defillama.com/protocol/compound-v3",
      "updated": "2025-01-31"
    },
    "arbitrum": {
      "chain": "arbitrum",
      "addresses": {
        "main": ""
      },
      "deploymentBlocks": {
        "main": null
      },
      "verified": {
        "main": false
      },
      "source": [
        "defillama"
      ],
      "sourceUrl": "https://defillama.com/protocol/compound-v3",
      "updated": "2025-01-31"
    },
    "base": {
      "chain": "base",
      "addresses": {
        "main": ""
      },
      "deploymentBlocks": {
        "main": null
      },
      "verified": {
        "main": false
      },
      "source": [
        "defillama"
      ],
      "sourceUrl": "https://defillama.com/protocol/compound-v3",
      "updated": "2025-01-31"
    },
    "polygon": {
      "chain": "polygon",
      "addresses": {
        "main": ""
      },
      "deploymentBlocks": {
        "main": null
      },
      "verified": {
        "main": false
      },
      "source": [
        "defillama"
      ],
      "sourceUrl": "https://defillama.com/protocol/compound-v3",
      "updated": "2025-01-31"
    },
    "mantle": {
      "chain": "mantle",
      "addresses": {
        "main": ""
      },
      "deploymentBlocks": {
        "main": null
      },
      "verified": {
        "main": false
      },
      "source": [
        "defillama"
      ],
      "sourceUrl": "https://defillama.com/protocol/compound-v3",
      "updated": "2025-01-31"
    },
    "unichain": {
      "chain": "unichain",
      "addresses": {
        "main": ""
      },
      "deploymentBlocks": {
        "main": null
      },
      "verified": {
        "main": false
      },
      "source": [
        "defillama"
      ],
      "sourceUrl": "https://defillama.com/protocol/compound-v3",
      "updated": "2025-01-31"
    },
    "ronin": {
      "chain": "ronin",
      "addresses": {
        "main": ""
      },
      "deploymentBlocks": {
        "main": null
      },
      "verified": {
        "main": false
      },
      "source": [
        "defillama"
      ],
      "sourceUrl": "https://defillama.com/protocol/compound-v3",
      "updated": "2025-01-31"
    },
    "scroll": {
      "chain": "scroll",
      "addresses": {
        "main": ""
      },
      "deploymentBlocks": {
        "main": null
      },
      "verified": {
        "main": false
      },
      "source": [
        "defillama"
      ],
      "sourceUrl": "https://defillama.com/protocol/compound-v3",
      "updated": "2025-01-31"
    }
  }
}