{
  "id": "metastable",
  "name": "Metastable",
  "type": "cdp",
  "website": "https://mstable.io",
  "github": "",
  "docs": "",
  "tags": [
    "cdp",
    "sui"
  ],
  "contracts": {
    "main": {
      "name": "Metastable Main Contract",
      "type": "core",
      "description": "Main contract for Metastable",
      "proxy": false,
      "keyEvents": [],
      "keyFunctions": [],
      "useCases": []
    }
  },
  "deployments": {
    "sui": {
      "chain": "sui",
      "addresses": {
        "main": ""
      },
      "deploymentBlocks": {
        "main": null
      },
      "verified": {
        "main": false
      },
      "source": [
        "defillama"
      ],
      "sourceUrl": "https://defillama.com/protocol/metastable",
      "updated": "2025-01-31",
      "platform": "move"
    }
  }
}