{
  "id": "ether-strategy",
  "name": "Ether Strategy",
  "type": "yield",
  "website": "https://ethsr.xyz/",
  "github": "",
  "docs": "",
  "tags": [
    "yield",
    "ethereum"
  ],
  "contracts": {
    "main": {
      "name": "Ether Strategy Main Contract",
      "type": "core",
      "description": "Main contract for Ether Strategy",
      "proxy": false,
      "keyEvents": [],
      "keyFunctions": [],
      "useCases": []
    }
  },
  "deployments": {
    "ethereum": {
      "chain": "ethereum",
      "addresses": {
        "main": ""
      },
      "deploymentBlocks": {
        "main": null
      },
      "verified": {
        "main": false
      },
      "source": [
        "defillama"
      ],
      "sourceUrl": "https://defillama.com/protocol/ether-strategy",
      "updated": "2025-01-31"
    }
  }
}