{
  "id": "bluefin-legacy",
  "name": "Bluefin Legacy",
  "type": "derivatives",
  "website": "https://bluefin.io",
  "github": "",
  "docs": "",
  "tags": [
    "derivatives",
    "sui",
    "arbitrum"
  ],
  "contracts": {
    "main": {
      "name": "Bluefin Legacy Main Contract",
      "type": "core",
      "description": "Main contract for Bluefin Legacy",
      "proxy": false,
      "keyEvents": [],
      "keyFunctions": [],
      "useCases": []
    }
  },
  "deployments": {
    "sui": {
      "chain": "sui",
      "addresses": {
        "main": ""
      },
      "deploymentBlocks": {
        "main": null
      },
      "verified": {
        "main": false
      },
      "source": [
        "defillama"
      ],
      "sourceUrl": "https://defillama.com/protocol/bluefin-legacy",
      "updated": "2025-01-31",
      "platform": "move"
    },
    "arbitrum": {
      "chain": "arbitrum",
      "addresses": {
        "main": ""
      },
      "deploymentBlocks": {
        "main": null
      },
      "verified": {
        "main": false
      },
      "source": [
        "defillama"
      ],
      "sourceUrl": "https://defillama.com/protocol/bluefin-legacy",
      "updated": "2025-01-31"
    }
  }
}