{
  "id": "exsat-bridge",
  "name": "exSat Bridge",
  "type": "bridge",
  "website": "https://exsat.network",
  "github": "",
  "docs": "",
  "tags": [
    "bridge",
    "bitcoin"
  ],
  "contracts": {
    "main": {
      "name": "exSat Bridge Main Contract",
      "type": "core",
      "description": "Main contract for exSat Bridge",
      "proxy": false,
      "keyEvents": [],
      "keyFunctions": [],
      "useCases": []
    }
  },
  "deployments": {
    "bitcoin": {
      "chain": "bitcoin",
      "addresses": {
        "main": ""
      },
      "deploymentBlocks": {
        "main": null
      },
      "verified": {
        "main": false
      },
      "source": [
        "defillama"
      ],
      "sourceUrl": "https://defillama.com/protocol/exsat-bridge",
      "updated": "2025-01-31",
      "platform": "bitcoin"
    }
  }
}